MCQ,Choices,Correct
What is the scientific study of life called?,a: Chemistry | b: Biology | c: Physics | d: Geology,b
Which theme in biology explains the unity and diversity of life?,a: Evolution | b: Energy processing | c: Cell structure | d: Regulation of internal environments,a
"What allows organisms to move, grow, and reproduce?",a: Evolution | b: Energy processing | c: Cell structure | d: Regulation of internal environments,b
How long ago did life on Earth emerge?,a: 3.7 million years ago | b: 3.7 thousand years ago | c: 3.7 billion years ago | d: 3.7 trillion years ago,c
What is the main unit of organization that biologists study?,a: Planets | b: Cells | c: Rocks | d: Stars,b
